# UPDATE / DELETE
statement ok
CREATE TABLE t5(id INTEGER, v TEXT);

statement ok
INSERT INTO t5 VALUES(1, 'x');
INSERT INTO t5 VALUES(2, 'y');
INSERT INTO t5 VALUES(3, 'z');

statement ok
UPDATE t5 SET v = 'yy' WHERE id = 2;

query IT
SELECT id, v FROM t5 ORDER BY id;
----
1 x
2 yy
3 z

statement ok
DELETE FROM t5 WHERE id = 1;

query IT
SELECT id, v FROM t5 ORDER BY id;
----
2 yy
3 z
